{
    "object_id": "https://w3id.org/biocompute/1.3.0/examples/UVP_BCO.json",
    "etag": "39fb1c62f43ff72ac95f91a433d5e425fb08bc07ec0f719ecfd27fb3cd3a3635",
    "spec_version": "https://w3id.org/ieee/ieee-2791-schema/2791object.json",
    "provenance_domain": {
        "name": "Lineage assignment for an isolate of M. tuberculosis based on its single nucleotide polymorphism (SNP) profile based on UVC v1.0.",
        "version": "v1.0",
        "review": [
            {
                "status": "approved",
                "reviewer_comment": "Approved by GW staff.",
                "date": "2017-11-12T12:30:48-0400",
                "reviewer": {
                    "name": "Anjan Purkayastha",
                    "affiliation": "George Washington University",
                    "email": "anjan.purkayastha@gmail.com",
                    "contribution": [
                        "curatedBy"
                    ]
                }
            },
            {
                "status": "approved",
                "reviewer_comment": "Approved by Critical Path Institute staff.",
                "date": "2017-11-12T12:30:48-0400",
                "reviewer": {
                    "name": "Marco Schito",
                    "affiliation": "Critical Path Institute",
                    "email": "mschito@c-path.org",
                    "contribution": [
                        "curatedBy"
                    ]
                }
            },
            {
                "status": "approved",
                "date": "2017-11-12T12:30:48-0400",
                "reviewer_comment": "Approved by Critical Path Institute staff.",
                "reviewer": {
                    "name": "Kenneth Ramey",
                    "affiliation": "Critical Path Institute",
                    "email": "kramey@c-path.org",
                    "contribution": [
                        "curatedBy"
                    ]
                }
            }
        ],
        "obsolete_after": "2118-09-26T14:43:43-0400",
        "embargo": {
            "start_time": "2000-09-26T14:43:43-0400",
            "end_time": "2018-10-08T18:02:33-0400"
        },
        "created": "2017-11-12T12:30:48-0400",
        "modified": "2018-10-08T18:35:33-0400",
        "contributors": [
            {
                "name": "Matthew Ezewudo",
                "affiliation": "Critical Path Institute",
                "email": "mezewudo@c-path.org",
                "contribution": [
                    "authoredBy"
                ]
            },
            {
                "name": "Jamie Posie",
                "affiliation": "CDC Atlanta, GA",
                "contribution": [
                    "authoredBy"
                ]
            },
            {
                "name": "Anjan Purkayastha",
                "affiliation": "George Washington University",
                "email": "anjan.purkayastha@gmail.com",
                "contribution": [
                    "authoredBy",
                    "curatedBy"
                ]
            },
            {
                "name": "Marco Schito",
                "affiliation": "Critical Path Institute",
                "email": "mschito@c-path.org",
                "contribution": [
                    "authoredBy"
                ]
            },
            {
                "name": "Charles Hadley King",
                "affiliation": "George Washington University",
                "email": "hadley_king@gwu.edu",
                "contribution": [
                    "authoredBy",
                    "curatedBy"
                ],
                "orcid": "https://orcid.org/0000-0003-1409-4549"
            },
            {
                "name": "ReseqTB Consortium",
                "affiliation": "Critical Path Institute",
                "email": "info@c-path.org",
                "contribution": [
                    "createdAt"
                ]
            }
        ],
        "license": "https://spdx.org/licenses/CC-BY-4.0.html"
    },
    "usability_domain": [
        "Lineage assignment for an isolate of M. tuberculosis[taxonomy:1773] based on its single nucleotide polymorphism [so:0000694] (SNP) profile."
    ],
    "extension_domain": [
        {
            "extension_schema": "https://raw.githubusercontent.com/biocompute-objects/extension_domain/1.1.0/scm/scm_extension.json",
            "scm_extension": {
                "scm_repository": "https://github.com/CPTR-ReSeqTB/UVP",
                "scm_type": "git",
                "scm_commit": "9e8f588b3cd3f5eebde29f7d2879e1a1e1c1aed3",
                "scm_path": "UVP/scripts/UVP.py"
            }
        }
    ],
    "description_domain": {
        "keywords": [
            "Mycobacterium tuberculosis",
            "Phylogenetics",
            "Bacterial lineage analysis",
            "Single Nucleotide Polymorphism",
            "SNP"
        ],
        "xref": [
            {
                "namespace": "pubmed",
                "name": "PubMed",
                "ids": [
                    "00000"
                ],
                "access_time": "2018-13-02T10:15-05:00"
            },
            {
                "namespace": "so",
                "name": "Sequence Ontology",
                "ids": [
                    "0000694"
                ],
                "access_time": "2018-13-02T10:15-05:00"
            },
            {
                "namespace": "taxonomy",
                "name": "Taxonomy",
                "ids": [
                    "1773"
                ],
                "access_time": "2018-13-02T10:15-05:00"
            }
        ],
        "platform": [
            "Linux"
        ],
        "pipeline_steps": [
            {
                "step_number": 1,
                "name": "FastQValidator",
                "description": "To verify if input file is in fastq format",
                "version": "1.0.5",
                "input_list": [
                    {
                        "uri": "http://bco.reseqtb.org/UVP-BCO/UVPv2.4.1_sample_input_fastq_files/ERR552106_1.fastq.gz"
                    },
                    {
                        "uri": "http://bco.reseqtb.org/UVP-BCO/UVPv2.4.1_sample_input_fastq_files/ERR552106_2.fastq.gz"
                    }
                ],
                "output_list": [
                    {
                        "uri": "http://bco.reseqtb.org/UVP-BCO/UVPv2.4.1_sample_results/ERR552106/validation/Validation_report.txt"
                    }
                ]
            },
            {
                "step_number": 2,
                "name": "FastQC",
                "description": "assess Quality of raw sequence reads",
                "version": "0.11.5",
                "input_list": [
                    {
                        "uri": "http://bco.reseqtb.org/UVP-BCO/UVPv2.4.1_sample_input_fastq_files/ERR552106_1.fastq.gz"
                    },
                    {
                        "uri": "http://bco.reseqtb.org/UVP-BCO/UVPv2.4.1_sample_input_fastq_files/ERR552106_2.fastq.gz"
                    }
                ],
                "output_list": [
                    {
                        "uri": "http://bco.reseqtb.org/UVP-BCO/UVPv2.4.1_sample_results/ERR552106/fastqc/ERR552106_1_fastqc.html"
                    },
                    {
                        "uri": "http://bco.reseqtb.org/UVP-BCO/UVPv2.4.1_sample_results/ERR552106/fastqc/ERR552106_1_fastqc.zip"
                    },
                    {
                        "uri": "http://bco.reseqtb.org/UVP-BCO/UVPv2.4.1_sample_results/ERR552106/fastqc/ERR552106_2_fastqc.html"
                    },
                    {
                        "uri": "http://bco.reseqtb.org/UVP-BCO/UVPv2.4.1_sample_results/ERR552106/fastqc/ERR552106_2_fastqc.zip"
                    }
                ]
            },
            {
                "step_number": 3,
                "name": "Kraken",
                "description": "Assesses species specificity of sequence reads",
                "version": "0.10.5",
                "input_list": [
                    {
                        "uri": "http://bco.reseqtb.org/UVP-BCO/UVPv2.4.1_sample_input_fastq_files/ERR552106_1.fastq.gz"
                    },
                    {
                        "uri": "http://bco.reseqtb.org/UVP-BCO/UVPv2.4.1_sample_input_fastq_files/ERR552106_2.fastq.gz"
                    }
                ],
                "output_list": [
                    {
                        "uri": "http://bco.reseqtb.org/UVP-BCO/UVPv2.4.1_sample_results/ERR552106/kraken/final_report.txt"
                    }
                ]
            },
            {
                "step_number": 4,
                "name": "BWA",
                "description": "Aligns sequence reads to reference genome",
                "version": "0.7.12",
                "prerequisite": [
                    {
                        "name": "M. tuberculosis H37Rv genome reference file",
                        "uri": {
                            "uri": "http://bco.reseqtb.org/UVP-BCO/UVPv2.4.1_reference_files/NC_000962.fa"
                        }
                    }
                ],
                "input_list": [
                    {
                        "uri": "http://bco.reseqtb.org/UVP-BCO/UVPv2.4.1_sample_input_fastq_files/ERR552106_1.fastq.gz"
                    },
                    {
                        "uri": "http://bco.reseqtb.org/UVP-BCO/UVPv2.4.1_sample_input_fastq_files/ERR552106_2.fastq.gz"
                    }
                ],
                "output_list": [
                    {
                        "uri": "http://bco.reseqtb.org/UVP-BCO/UVPv2.4.1_sample_results/ERR552106/bam_files/ERR552106.bam"
                    }
                ]
            },
            {
                "step_number": 5,
                "name": "Qualimap",